{
  "schema_version": 1,
  "baseline_revision": 1,
  "scope": "blueprint-selected-implementation-inputs",
  "inputs": [
    {
      "id": "behavioral-oracle",
      "kind": "restricted-oracle",
      "version": "5.3.15",
      "commit": null,
      "filename": "Cathedral Assets Optimizer 64-23316-5-3-15-1687526925.7z",
      "source_uri": "https://www.nexusmods.com/skyrimspecialedition/mods/23316?tab=files",
      "acquisition": "Download the named v5.3.15 archive into the ignored local oracle kit; never commit or redistribute it.",
      "redistribution": "restricted-local-only",
      "license_expression": null,
      "selected_license": null,
      "default_features": null,
      "required_features": [],
      "patches": [],
      "verification": {
        "method": "sha256",
        "arguments": [],
        "allowed_exit_codes": [],
        "sha256": "b25cf0c0c97160b602dd47c252af2ede735c27abe565c9ab84d272306308abb6",
        "size_bytes": 10410192,
        "expected": null
      }
    },
    {
      "id": "rust-toolchain",
      "kind": "rust-toolchain",
      "version": "1.97.0",
      "commit": null,
      "filename": null,
      "source_uri": "https://static.rust-lang.org/dist/channel-rust-1.97.0.toml",
      "acquisition": "Install the exact rustup toolchain named 1.97.0 and verify rustc reports that release.",
      "redistribution": "toolchain-managed",
      "license_expression": "Apache-2.0 OR MIT",
      "selected_license": null,
      "default_features": null,
      "required_features": ["x86_64-pc-windows-msvc"],
      "patches": [],
      "verification": {
        "method": "version-output",
        "arguments": ["--version"],
        "allowed_exit_codes": [0],
        "sha256": null,
        "size_bytes": null,
        "expected": "rustc 1.97.0"
      }
    },
    {
      "id": "crossbeam-channel",
      "kind": "rust-crate",
      "version": "0.5.16",
      "commit": null,
      "filename": "crossbeam-channel-0.5.16.crate",
      "source_uri": "https://static.crates.io/crates/crossbeam-channel/crossbeam-channel-0.5.16.crate",
      "acquisition": "Acquire from crates.io by exact version and verify the registry checksum before offline use.",
      "redistribution": "source-redistributable",
      "license_expression": "MIT OR Apache-2.0",
      "selected_license": "Apache-2.0",
      "default_features": false,
      "required_features": ["std"],
      "patches": [],
      "verification": {
        "method": "sha256",
        "arguments": [],
        "allowed_exit_codes": [],
        "sha256": "d85363c37faeca707aef026efa9f3b34d077bce547e48f770770625c6013679e",
        "size_bytes": 93189,
        "expected": null
      }
    },
    {
      "id": "ba2",
      "kind": "rust-crate",
      "version": "3.0.1",
      "commit": null,
      "filename": "ba2-3.0.1.crate",
      "source_uri": "https://static.crates.io/crates/ba2/ba2-3.0.1.crate",
      "acquisition": "Acquire from crates.io by exact version and verify the registry checksum before offline use.",
      "redistribution": "source-redistributable",
      "license_expression": "0BSD",
      "selected_license": "0BSD",
      "default_features": false,
      "required_features": ["zlib"],
      "patches": [{
        "path": "patches/ba2-3.0.1-explicit-zlib-feature.patch",
        "sha256": "2e9d3e348ba64f2066c8eae47d662a3d8df7015daa8198cb39d2f279447513d1",
        "size_bytes": 114,
        "normalization": "lf-text"
      }],
      "verification": {
        "method": "sha256",
        "arguments": [],
        "allowed_exit_codes": [],
        "sha256": "7fdb05c5c954898b463887df1145016492deee06e9a778f8af491c7cde14c210",
        "size_bytes": 56922,
        "expected": null
      }
    },
    {
      "id": "nifly",
      "kind": "native-source",
      "version": null,
      "commit": "965a1da1be7bff145b7b3435def5c04d6e8c8cce",
      "filename": "nifly-965a1da1be7bff145b7b3435def5c04d6e8c8cce.tar.gz",
      "source_uri": "https://codeload.github.com/ousnius/nifly/tar.gz/965a1da1be7bff145b7b3435def5c04d6e8c8cce",
      "acquisition": "Download the immutable commit archive and verify it before the locked offline build.",
      "redistribution": "source-redistributable",
      "license_expression": "GPL-3.0-only",
      "selected_license": "GPL-3.0-only",
      "default_features": null,
      "required_features": ["static-library", "cao-owned-byte-buffer-abi"],
      "patches": [],
      "verification": {
        "method": "sha256",
        "arguments": [],
        "allowed_exit_codes": [],
        "sha256": "fcc737f7362e9326b4585210b5173aa2d1b4caa6395cddf2ad5a99cb625b55c3",
        "size_bytes": 2683604,
        "expected": null
      }
    },
    {
      "id": "directxtex",
      "kind": "native-source",
      "version": "May 2026",
      "commit": "4feb3e11a020f35b796fc769a74216a555d4f5ef",
      "filename": "DirectXTex-4feb3e11a020f35b796fc769a74216a555d4f5ef.tar.gz",
      "source_uri": "https://codeload.github.com/microsoft/DirectXTex/tar.gz/4feb3e11a020f35b796fc769a74216a555d4f5ef",
      "acquisition": "Download the immutable commit archive and verify it before the locked offline build.",
      "redistribution": "source-redistributable",
      "license_expression": "MIT",
      "selected_license": "MIT",
      "default_features": null,
      "required_features": ["static-library", "D3D11", "CPU-BC6H-BC7"],
      "patches": [],
      "verification": {
        "method": "sha256",
        "arguments": [],
        "allowed_exit_codes": [],
        "sha256": "9488bdc5c292534caed070276d426bbf89a021d4e6764a56fcc4a41b2198758e",
        "size_bytes": 540056,
        "expected": null
      }
    },
    {
      "id": "serde-hkx",
      "kind": "rust-crate",
      "version": "1.0.1",
      "commit": "6c1bee56d42de7def991cf6fba025a9df7492d83",
      "filename": "serde-hkx-6c1bee56d42de7def991cf6fba025a9df7492d83.tar.gz",
      "source_uri": "https://codeload.github.com/SARDONYX-sard/serde-hkx/tar.gz/6c1bee56d42de7def991cf6fba025a9df7492d83",
      "acquisition": "Download the immutable commit archive, verify it, and vendor only the minimal binary conversion graph.",
      "redistribution": "source-redistributable",
      "license_expression": "MIT OR Apache-2.0",
      "selected_license": "Apache-2.0",
      "default_features": false,
      "required_features": ["binary-conversion", "generated-class-map", "helper-only"],
      "patches": [],
      "verification": {
        "method": "sha256",
        "arguments": [],
        "allowed_exit_codes": [],
        "sha256": "34f5cb574f8bc5a67354aa3d5c184abfa79e41007cd7955786d47ed950dcc430",
        "size_bytes": 2095765,
        "expected": null
      }
    },
    {
      "id": "slint",
      "kind": "ui-toolkit",
      "version": "1.17.1",
      "commit": null,
      "filename": "slint-1.17.1.crate",
      "source_uri": "https://static.crates.io/crates/slint/slint-1.17.1.crate",
      "acquisition": "Acquire from crates.io by exact version and verify the registry checksum before offline use.",
      "redistribution": "source-redistributable",
      "license_expression": "GPL-3.0-only",
      "selected_license": "GPL-3.0-only",
      "default_features": false,
      "required_features": ["std", "compat-1-2", "accessibility", "backend-winit", "renderer-skia", "renderer-software"],
      "patches": [],
      "verification": {
        "method": "sha256",
        "arguments": [],
        "allowed_exit_codes": [],
        "sha256": "ce12038f57f8f3a423564b0c9301a2ab3fda4246e4cbadd6b97acf9124bdc315",
        "size_bytes": 111462,
        "expected": null
      }
    },
    {
      "id": "ba2-directxtex",
      "kind": "transitive-native-source",
      "version": "1.3.0",
      "commit": "8e44d15166acb5c5d03864ac58e593da8f8e555b",
      "filename": "directxtex-1.3.0.crate",
      "source_uri": "https://static.crates.io/crates/directxtex/directxtex-1.3.0.crate",
      "acquisition": "Pin this exact ba2-only transitive crate in Cargo.lock; its verified crate archive contains DirectXTex 9260384a375e0b39e7b22c8c67fd0d060f0c948a, DirectX-Headers 48a762973271c5a75869946bf1fdbc489a628a5c, and DirectXMath 0d821781da4ed0f20cad4e30e618afab45a08f0f source.",
      "redistribution": "source-redistributable",
      "license_expression": "MIT",
      "selected_license": "MIT",
      "default_features": false,
      "required_features": ["ba2-transitive-only", "static-library"],
      "patches": [],
      "verification": {
        "method": "sha256",
        "arguments": [],
        "allowed_exit_codes": [],
        "sha256": "0f0cea4cfe7ef3eeeae77cbbe6c8eddb7e518b1af877ca788b7a9d4fde45e658",
        "size_bytes": 797360,
        "expected": null
      }
    },
    {
      "id": "ba2-lzzzz",
      "kind": "transitive-native-source",
      "version": "1.0.4",
      "commit": "226150ad7c8dda5cd782f5580040c74c1c9b2842",
      "filename": "lzzzz-1.0.4.crate",
      "source_uri": "https://static.crates.io/crates/lzzzz/lzzzz-1.0.4.crate",
      "acquisition": "Pin this exact ba2 transitive crate in Cargo.lock; its verified crate archive vendors LZ4 1.9.4 at upstream commit 5ff839680134437dbf4678f3d0c7b371d84f4964.",
      "redistribution": "source-redistributable",
      "license_expression": "MIT AND BSD-2-Clause",
      "selected_license": "MIT AND BSD-2-Clause",
      "default_features": false,
      "required_features": ["vendored-lz4-1.9.4", "static-library"],
      "patches": [],
      "verification": {
        "method": "sha256",
        "arguments": [],
        "allowed_exit_codes": [],
        "sha256": "8014d1362004776e6a91e4c15a3aa7830d1b6650a075b51a9969ebb6d6af13bc",
        "size_bytes": 128643,
        "expected": null
      }
    },
    {
      "id": "msvc-build-tools",
      "kind": "windows-toolchain",
      "version": "18.7.3+11925.98",
      "commit": null,
      "filename": "vs_BuildTools-18.7.3.exe",